{
  "schema_version": "1.0.0",
  "episode_id": "PD-2026-021-dbcooper",
  "revision": "v001",
  "language": "en",
  "thesis": "The 1971 D.B. Cooper hijacking is the only unsolved skyjacking in U.S. history: a calm man took $200,000, parachuted into a freezing night over southwestern Washington, and vanished. After a 45-year manhunt, more than 800 suspects, and the one bundle of ransom a boy found in 1980, the FBI suspended the case in 2016 without ever identifying him.",
  "viewer_promise": "You will understand the hijacking minute by minute, what the single recovered clue does and doesn't prove, why every suspect theory falls short, and why the FBI suspended the case it never solved.",
  "chapters": [
    {
      "chapter_id": "hook",
      "title": "Hook",
      "function": "cold_open_tease",
      "span_ids": [
        "SPN-0001"
      ]
    },
    {
      "chapter_id": "opening",
      "title": "Opening — The Man Who Wasn't There",
      "function": "thesis_and_promise",
      "span_ids": [
        "SPN-0002",
        "SPN-0003",
        "SPN-0004",
        "SPN-0005",
        "SPN-0006",
        "SPN-0007",
        "SPN-0008"
      ]
    },
    {
      "chapter_id": "act1",
      "title": "Act I — The Quiet Hijacking",
      "function": "event",
      "span_ids": [
        "SPN-0009",
        "SPN-0010",
        "SPN-0011",
        "SPN-0012",
        "SPN-0013",
        "SPN-0014",
        "SPN-0015",
        "SPN-0016",
        "SPN-0017",
        "SPN-0018",
        "SPN-0019",
        "SPN-0020",
        "SPN-0021",
        "SPN-0022"
      ]
    },
    {
      "chapter_id": "act2",
      "title": "Act II — The Vanishing",
      "function": "event",
      "span_ids": [
        "SPN-0023",
        "SPN-0024",
        "SPN-0025",
        "SPN-0026",
        "SPN-0027",
        "SPN-0028",
        "SPN-0029",
        "SPN-0030",
        "SPN-0031",
        "SPN-0032",
        "SPN-0033",
        "SPN-0034"
      ]
    },
    {
      "chapter_id": "act3",
      "title": "Act III — The Manhunt",
      "function": "investigation",
      "span_ids": [
        "SPN-0035",
        "SPN-0036",
        "SPN-0037",
        "SPN-0038",
        "SPN-0039",
        "SPN-0040",
        "SPN-0041",
        "SPN-0042",
        "SPN-0043",
        "SPN-0044",
        "SPN-0045"
      ]
    },
    {
      "chapter_id": "act4",
      "title": "Act IV — The One Clue",
      "function": "analysis",
      "span_ids": [
        "SPN-0046",
        "SPN-0047",
        "SPN-0048",
        "SPN-0049",
        "SPN-0050",
        "SPN-0051",
        "SPN-0052",
        "SPN-0053",
        "SPN-0054"
      ]
    },
    {
      "chapter_id": "ending",
      "title": "Ending — The Open Door",
      "function": "payoff_and_cta",
      "span_ids": [
        "SPN-0055",
        "SPN-0056",
        "SPN-0057",
        "SPN-0058",
        "SPN-0059",
        "SPN-0060",
        "SPN-0061"
      ]
    }
  ],
  "spans": [
    {
      "span_id": "SPN-0001",
      "text": "A man in a business suit hijacked a passenger jet, collected two hundred thousand dollars, and parachuted into a freezing night. More than fifty years later, the FBI still cannot tell you his name.",
      "claim_ids": [
        "CLM-0007",
        "CLM-0010"
      ],
      "narrative_function": "hook_cold_open",
      "visual_intent": "Fast flash-forward montage (EP21-IMG-001..006): faceless suited man, briefcase, cash, four parachutes, open aft airstair into a black storm, riverbank money. Symbolic, no face/logo/text."
    },
    {
      "span_id": "SPN-0002",
      "text": "Almost every crime leaves something behind. A fingerprint on a glass. A body in the ground. A name, a face, a witness, a paper trail that, with enough time and enough people pulling on it, eventually leads somewhere.",
      "claim_ids": [
        "CLM-0009"
      ],
      "narrative_function": "thesis_and_promise",
      "visual_intent": "The man-shaped absence / empty 1970s cabin seat; a trail that stops; the legend forming in the rain; brand title cards. No likeness."
    },
    {
      "span_id": "SPN-0003",
      "text": "This one led nowhere.",
      "claim_ids": [
        "CLM-0010"
      ],
      "narrative_function": "thesis_and_promise",
      "visual_intent": "The man-shaped absence / empty 1970s cabin seat; a trail that stops; the legend forming in the rain; brand title cards. No likeness."
    },
    {
      "span_id": "SPN-0004",
      "text": "On the night before Thanksgiving, in 1971, a quiet man talked his way onto a passenger plane, threatened it with a bomb, collected a fortune in cash, and walked out the back of the aircraft into the dark sky. He was never seen again. Not his face, not his body, not the money strapped to his chest. He simply stopped existing somewhere over the forests of the Pacific Northwest, and he has stayed gone ever since.",
      "claim_ids": [
        "CLM-0001",
        "CLM-0007"
      ],
      "narrative_function": "thesis_and_promise",
      "visual_intent": "The man-shaped absence / empty 1970s cabin seat; a trail that stops; the legend forming in the rain; brand title cards. No likeness."
    },
    {
      "span_id": "SPN-0005",
      "text": "The world came to know him by a name that was never even his. D.B. Cooper. Over the next fifty years that name grew into something far stranger than a criminal. It became a legend, an unsolved itch the country could not stop scratching. More than eight hundred suspects. A forty-five-year manhunt. Books, songs, conventions, and a single bundle of rotting twenty-dollar bills dug out of a riverbank by a child.",
      "claim_ids": [
        "CLM-0009",
        "CLM-0011"
      ],
      "narrative_function": "thesis_and_promise",
      "visual_intent": "The man-shaped absence / empty 1970s cabin seat; a trail that stops; the legend forming in the rain; brand title cards. No likeness."
    },
    {
      "span_id": "SPN-0006",
      "text": "None of it was ever enough to give him a name.",
      "claim_ids": [
        "CLM-0010"
      ],
      "narrative_function": "thesis_and_promise",
      "visual_intent": "The man-shaped absence / empty 1970s cabin seat; a trail that stops; the legend forming in the rain; brand title cards. No likeness."
    },
    {
      "span_id": "SPN-0007",
      "text": "It helps to know the moment he stepped into. The early 1970s were the golden age of the airplane hijacking in America. There were dozens of them, year after year, so many that flight crews were quietly trained to go along with it, to keep everyone calm, hand over what was asked, and get the plane safely back on the ground. Most of those hijackers wanted a destination, usually Cuba, and a cause they could shout about. This man wanted none of that. No country, no manifesto, no audience. He wanted cash, and a parachute, and a way to walk off the edge of the map. That alone set him apart before he had done anything at all.",
      "claim_ids": [],
      "narrative_function": "thesis_and_promise",
      "visual_intent": "The man-shaped absence / empty 1970s cabin seat; a trail that stops; the legend forming in the rain; brand title cards. No likeness."
    },
    {
      "span_id": "SPN-0008",
      "text": "Over the next half hour we are going to do three things. First, we will walk through exactly what happened that night, minute by minute, because the calm of it is somehow more chilling than any violence would have been. Then we will look at the only solid piece of evidence the case ever produced, and what it does and does not prove. And finally we will sit with the question that has outlived nearly everyone who ever chased it. Who was he, and did he even survive the fall? After half a century, the honest answer is also the most maddening one there is. Nobody knows.",
      "claim_ids": [
        "CLM-0007",
        "CLM-0011",
        "CLM-0013"
      ],
      "narrative_function": "thesis_and_promise",
      "visual_intent": "The man-shaped absence / empty 1970s cabin seat; a trail that stops; the legend forming in the rain; brand title cards. No likeness."
    },
    {
      "span_id": "SPN-0009",
      "text": "He bought his ticket under the name Dan Cooper. A short hop, Portland to Seattle, the kind of late-afternoon flight nobody is supposed to remember. He paid cash. He carried a briefcase. He took a seat near the back of the Boeing 727, ordered a drink, and waited. By the descriptions that survive, he looked like a middle-aged businessman in a dark suit and a thin tie. Forgettable, almost certainly on purpose.",
      "claim_ids": [
        "CLM-0001",
        "CLM-0014"
      ],
      "narrative_function": "act_hijacking",
      "visual_intent": "1971 cabin, the passed note, the briefcase of wires/red cylinders, banded cash + four chutes, the calm (cigarette + bourbon), the night exchange on the tarmac, the 727 aft airstair."
    },
    {
      "span_id": "SPN-0010",
      "text": "The famous initials came later, and by accident. In the chaos of that first night, a wire-service report garbled the details, and the wrong name went out across the country. It stuck. The man on the plane called himself Dan Cooper. The world has called him D.B. Cooper ever since, which means that even his fake name is, in a small way, a mistake nobody ever managed to correct.",
      "claim_ids": [
        "CLM-0001"
      ],
      "narrative_function": "act_hijacking",
      "visual_intent": "1971 cabin, the passed note, the briefcase of wires/red cylinders, banded cash + four chutes, the calm (cigarette + bourbon), the night exchange on the tarmac, the 727 aft airstair."
    },
    {
      "span_id": "SPN-0011",